{
  "$schema": "https://json-schema.org/draft/2020-12/schema",
  "$id": "https://github.com/Neuronautix/ComputationalReviewTemplate_trust-knowledge/docs/contracts/contributorship/v1/contributorship.public.schema.json",
  "title": "comprev.contributorship/1 (public)",
  "description": "Public projection of the contributorship companion. Every object is closed: a field outside this schema (and outside PUBLIC_ALLOWLIST in scripts/contributorship/build.mjs) cannot be published. No private project ids, unpublished collaborators, source curator pseudonyms, prompts or quotation text.",
  "type": "object",
  "additionalProperties": false,
  "required": ["schema", "visibility", "credit_standard", "subject", "contributors", "credit_assertions", "production", "source_credit", "relation_proposals"],
  "properties": {
    "schema": { "const": "comprev.contributorship/1" },
    "visibility": { "const": "public" },
    "credit_standard": { "const": "ANSI/NISO Z39.104-2022" },
    "subject": {
      "type": "object",
      "additionalProperties": false,
      "required": ["review_id", "version", "claim_graph_sha256"],
      "properties": {
        "review_id": { "type": "string", "pattern": "^review-[a-z0-9][a-z0-9-]{2,63}$" },
        "version": { "type": "string", "pattern": "^(0|[1-9][0-9]*)\\.(0|[1-9][0-9]*)\\.(0|[1-9][0-9]*)$" },
        "claim_graph_sha256": { "$ref": "#/$defs/sha256" }
      }
    },
    "contributors": { "type": "array", "items": { "$ref": "#/$defs/contributor" } },
    "credit_assertions": { "type": "array", "items": { "$ref": "#/$defs/assertion" } },
    "production": {
      "type": "object",
      "additionalProperties": false,
      "required": ["agent_runs"],
      "properties": { "agent_runs": { "type": "array", "items": { "$ref": "#/$defs/agentRun" } } }
    },
    "source_credit": { "type": "array", "items": { "$ref": "#/$defs/sourceCredit" } },
    "relation_proposals": { "type": "array", "items": { "$ref": "#/$defs/relationProposal" } }
  },
  "$defs": {
    "id": { "type": "string", "pattern": "^[a-z][a-z0-9-]{1,63}$" },
    "nullableText": { "type": ["string", "null"], "minLength": 1 },
    "sha256": { "type": "string", "pattern": "^sha256:[a-f0-9]{64}$" },
    "claimId": { "type": "string", "pattern": "^clm_[a-f0-9]{16}$" },
    "timestamp": { "type": "string", "format": "date-time", "pattern": "Z$" },
    "contributor": {
      "type": "object",
      "additionalProperties": false,
      "required": ["id", "kind", "display_name"],
      "properties": {
        "id": { "$ref": "#/$defs/id" },
        "kind": { "const": "person" },
        "display_name": { "type": "string", "minLength": 1 },
        "orcid": {
          "type": "object",
          "additionalProperties": false,
          "required": ["id", "status"],
          "properties": {
            "id": { "type": "string", "pattern": "^\\d{4}-\\d{4}-\\d{4}-\\d{3}[\\dX]$" },
            "status": { "enum": ["claimed", "verified"] }
          }
        },
        "credit_statement": { "$ref": "#/$defs/nullableText" }
      }
    },
    "assertion": {
      "type": "object",
      "additionalProperties": false,
      "required": ["assertion_id", "contributor", "role", "role_label", "role_uri", "degree", "status", "source_kind", "asserted_at", "target"],
      "properties": {
        "assertion_id": { "type": "string", "pattern": "^[a-z0-9][a-z0-9:._-]{0,127}$" },
        "contributor": { "$ref": "#/$defs/id" },
        "role": { "enum": ["conceptualization", "data-curation", "formal-analysis", "funding-acquisition", "investigation", "methodology", "project-administration", "resources", "software", "supervision", "validation", "visualization", "writing-original-draft", "writing-review-editing"] },
        "role_label": { "type": "string" },
        "role_uri": { "type": "string", "pattern": "^https://credit\\.niso\\.org/contributor-roles/[a-z-]+/$" },
        "degree": { "enum": ["lead", "equal", "supporting", null] },
        "status": { "enum": ["declared", "confirmed"] },
        "source_kind": { "enum": ["self-declared", "corresponding-author", "controller", "legacy-author-file"] },
        "asserted_at": { "anyOf": [{ "$ref": "#/$defs/timestamp" }, { "type": "null" }] },
        "target": {
          "oneOf": [
            { "type": "object", "additionalProperties": false, "required": ["kind"], "properties": { "kind": { "const": "review" } } },
            { "type": "object", "additionalProperties": false, "required": ["kind", "claim_id"], "properties": { "kind": { "const": "claim" }, "claim_id": { "$ref": "#/$defs/claimId" } } }
          ]
        }
      }
    },
    "agentRun": {
      "type": "object",
      "additionalProperties": false,
      "required": ["agent_id", "kind", "name", "version", "workflow_role", "producer", "credit_channel"],
      "properties": {
        "agent_id": { "$ref": "#/$defs/id" },
        "kind": { "const": "software-agent" },
        "name": { "type": "string", "minLength": 1 },
        "version": { "$ref": "#/$defs/nullableText" },
        "workflow_role": { "$ref": "#/$defs/nullableText" },
        "producer": { "$ref": "#/$defs/nullableText" },
        "credit_channel": { "const": "production" }
      }
    },
    "sourceFinding": {
      "type": "object",
      "additionalProperties": false,
      "required": ["finding_id", "finding_revision", "phase2_finding_sha256", "binding", "packet", "cited_work", "passage_disclosure", "source_assessments", "source_curation"],
      "properties": {
        "finding_id": { "type": "string", "pattern": "^finding:" },
        "finding_revision": { "type": "integer", "minimum": 1 },
        "phase2_finding_sha256": { "$ref": "#/$defs/sha256" },
        "binding": { "const": "reviewed-mapping" },
        "packet": {
          "type": "object",
          "additionalProperties": false,
          "required": ["packet_id", "manifest_sha256"],
          "properties": { "packet_id": { "type": "string", "pattern": "^packet:" }, "manifest_sha256": { "$ref": "#/$defs/sha256" } }
        },
        "cited_work": {
          "type": "object",
          "additionalProperties": false,
          "required": ["credit_kind", "cite_key", "doi", "authors"],
          "properties": {
            "credit_kind": { "const": "bibliographic-citation" },
            "cite_key": { "type": ["string", "null"] },
            "doi": { "type": "string", "pattern": "^10\\." },
            "authors": { "type": "array", "items": { "type": "string" } }
          }
        },
        "passage_disclosure": { "enum": ["rights-allow", "rights-restricted"] },
        "passages": {
          "type": "array",
          "items": {
            "type": "object",
            "additionalProperties": false,
            "required": ["passage_id", "quote_sha256"],
            "properties": { "passage_id": { "type": "string", "pattern": "^passage:" }, "quote_sha256": { "$ref": "#/$defs/sha256" } }
          }
        },
        "source_assessments": {
          "type": "array",
          "items": {
            "type": "object",
            "additionalProperties": false,
            "required": ["assessment_id", "protocol", "status"],
            "properties": {
              "assessment_id": { "type": "string", "pattern": "^assessment:" },
              "protocol": { "type": "string", "minLength": 1 },
              "status": { "type": "string", "minLength": 1 }
            }
          }
        },
        "source_curation": {
          "type": "object",
          "additionalProperties": false,
          "required": ["credit_channel", "review_authorship"],
          "properties": { "credit_channel": { "const": "source-native" }, "review_authorship": { "const": false } }
        }
      },
      "if": { "properties": { "passage_disclosure": { "const": "rights-allow" } } },
      "then": { "required": ["passages"] },
      "else": { "not": { "required": ["passages"] } }
    },
    "sourceCredit": {
      "type": "object",
      "additionalProperties": false,
      "required": ["claim_id", "findings"],
      "properties": {
        "claim_id": { "$ref": "#/$defs/claimId" },
        "findings": { "type": "array", "minItems": 1, "items": { "$ref": "#/$defs/sourceFinding" } }
      }
    },
    "relationProposal": {
      "type": "object",
      "additionalProperties": false,
      "required": ["relation_id", "proposed_by", "predicate", "finding_refs"],
      "properties": {
        "relation_id": { "type": "string", "minLength": 1 },
        "proposed_by": { "$ref": "#/$defs/id" },
        "predicate": { "enum": ["supports", "contradicts", "qualifies"] },
        "claim_id": { "$ref": "#/$defs/claimId" },
        "finding_refs": {
          "type": "array",
          "minItems": 2,
          "items": {
            "type": "object",
            "additionalProperties": false,
            "required": ["finding_id", "finding_revision"],
            "properties": { "finding_id": { "type": "string", "pattern": "^finding:" }, "finding_revision": { "type": "integer", "minimum": 1 } }
          }
        }
      }
    }
  }
}
